{
  "databaseId": "00000000000000000000000000000001",
  "dialect": "voxel",
  "enums": [],
  "formatVersion": 1,
  "migrationId": "00000000000000000000000000000013",
  "requirements": [],
  "schemas": [
    {
      "id": "00000000000000000000000000000002",
      "name": "content"
    }
  ],
  "tables": [
    {
      "columns": [
        {
          "id": "00000000000000000000000000000004",
          "name": "tenant",
          "primaryKey": false,
          "storage": {
            "codecVersion": 1,
            "kind": "text",
            "nullable": false
          },
          "tableId": "00000000000000000000000000000003"
        },
        {
          "id": "00000000000000000000000000000005",
          "name": "id",
          "primaryKey": false,
          "storage": {
            "codecVersion": 1,
            "kind": "text",
            "nullable": false
          },
          "tableId": "00000000000000000000000000000003"
        },
        {
          "id": "00000000000000000000000000000006",
          "name": "name",
          "primaryKey": false,
          "storage": {
            "codecVersion": 1,
            "kind": "text",
            "nullable": false
          },
          "tableId": "00000000000000000000000000000003"
        },
        {
          "id": "00000000000000000000000000000007",
          "name": "favoriteChildTenant",
          "primaryKey": false,
          "storage": {
            "codecVersion": 1,
            "kind": "text",
            "nullable": true
          },
          "tableId": "00000000000000000000000000000003"
        },
        {
          "id": "00000000000000000000000000000008",
          "name": "favoriteChildId",
          "primaryKey": false,
          "storage": {
            "codecVersion": 1,
            "kind": "text",
            "nullable": true
          },
          "tableId": "00000000000000000000000000000003"
        }
      ],
      "constraints": [
        {
          "columnIds": [
            "00000000000000000000000000000004",
            "00000000000000000000000000000005"
          ],
          "id": "0000000000000000000000000000000f",
          "kind": "primaryKey",
          "name": "parents_pk",
          "tableId": "00000000000000000000000000000003"
        },
        {
          "columnIds": [
            "00000000000000000000000000000007",
            "00000000000000000000000000000008"
          ],
          "id": "00000000000000000000000000000010",
          "kind": "foreignKey",
          "name": "parents_favorite_child_fk",
          "onDelete": "noAction",
          "onUpdate": "noAction",
          "referenceColumnIds": [
            "0000000000000000000000000000000a",
            "0000000000000000000000000000000b"
          ],
          "referenceTableId": "00000000000000000000000000000009",
          "tableId": "00000000000000000000000000000003"
        }
      ],
      "id": "00000000000000000000000000000003",
      "indexes": [
        {
          "id": "0000000000000000000000000000000e",
          "name": "parents_name_unique",
          "options": {},
          "platforms": [
            "native",
            "browser"
          ],
          "predicate": {
            "arguments": [
              {
                "formatVersion": 1,
                "kind": "reference",
                "objectId": "00000000000000000000000000000008"
              }
            ],
            "formatVersion": 1,
            "kind": "operator",
            "operator": "IS NULL"
          },
          "tableId": "00000000000000000000000000000003",
          "terms": [
            {
              "columnId": "00000000000000000000000000000006",
              "descending": false
            }
          ],
          "unique": true
        }
      ],
      "name": "parents",
      "schemaId": "00000000000000000000000000000002"
    },
    {
      "columns": [
        {
          "id": "0000000000000000000000000000000a",
          "name": "tenant",
          "primaryKey": false,
          "storage": {
            "codecVersion": 1,
            "kind": "text",
            "nullable": false
          },
          "tableId": "00000000000000000000000000000009"
        },
        {
          "id": "0000000000000000000000000000000b",
          "name": "id",
          "primaryKey": false,
          "storage": {
            "codecVersion": 1,
            "kind": "text",
            "nullable": false
          },
          "tableId": "00000000000000000000000000000009"
        },
        {
          "id": "0000000000000000000000000000000c",
          "name": "parentTenant",
          "primaryKey": false,
          "storage": {
            "codecVersion": 1,
            "kind": "text",
            "nullable": false
          },
          "tableId": "00000000000000000000000000000009"
        },
        {
          "id": "0000000000000000000000000000000d",
          "name": "parentId",
          "primaryKey": false,
          "storage": {
            "codecVersion": 1,
            "kind": "text",
            "nullable": false
          },
          "tableId": "00000000000000000000000000000009"
        }
      ],
      "constraints": [
        {
          "columnIds": [
            "0000000000000000000000000000000a",
            "0000000000000000000000000000000b"
          ],
          "id": "00000000000000000000000000000011",
          "kind": "primaryKey",
          "name": "children_pk",
          "tableId": "00000000000000000000000000000009"
        },
        {
          "columnIds": [
            "0000000000000000000000000000000c",
            "0000000000000000000000000000000d"
          ],
          "id": "00000000000000000000000000000012",
          "kind": "foreignKey",
          "name": "children_parent_fk",
          "onDelete": "noAction",
          "onUpdate": "noAction",
          "referenceColumnIds": [
            "00000000000000000000000000000004",
            "00000000000000000000000000000005"
          ],
          "referenceTableId": "00000000000000000000000000000003",
          "tableId": "00000000000000000000000000000009"
        }
      ],
      "id": "00000000000000000000000000000009",
      "indexes": [],
      "name": "children",
      "schemaId": "00000000000000000000000000000002"
    }
  ]
}
